{
  "$schema": "../../../schemas/banlist.schema.json",
  "id": "tcg-2005-04",
  "region": "TCG",
  "effective_date": "2005-04-01",
  "superseded_by_date": "2005-10-01",
  "supersedes": null,
  "entries": [
    {
      "card": {
        "passcode": 2460565,
        "name": "Marauding Captain"
      },
      "status": "semilimited"
    },
    {
      "card": {
        "passcode": 2851070,
        "name": "Reflect Bounder"
      },
      "status": "limited"
    },
    {
      "card": {
        "passcode": 3078576,
        "name": "Yata-Garasu"
      },
      "status": "forbidden"
    },
    {
      "card": {
        "passcode": 3136426,
        "name": "Level Limit - Area B"
      },
      "status": "semilimited"
    },
    {
      "card": {
        "passcode": 4031928,
        "name": "Change of Heart"
      },
      "status": "forbidden"
    },
    {
      "card": {
        "passcode": 5318639,
        "name": "Mystical Space Typhoon"
      },
      "status": "limited"
    },
    {
      "card": {
        "passcode": 7572887,
        "name": "D.D. Warrior Lady"
      },
      "status": "limited"
    },
    {
      "card": {
        "passcode": 7902349,
        "name": "Left Arm of the Forbidden One"
      },
      "status": "limited"
    },
    {
      "card": {
        "passcode": 8124921,
        "name": "Right Leg of the Forbidden One"
      },
      "status": "limited"
    },
    {
      "card": {
        "passcode": 8131171,
        "name": "Sinister Serpent"
      },
      "status": "limited"
    },
    {
      "card": {
        "passcode": 9744376,
        "name": "Good Goblin Housekeeping"
      },
      "status": "semilimited"
    },
    {
      "card": {
        "passcode": 12580477,
        "name": "Raigeki"
      },
      "status": "forbidden"
    },
    {
      "card": {
        "passcode": 16226786,
        "name": "Night Assailant"
      },
      "status": "semilimited"
    },
    {
      "card": {
        "passcode": 17375316,
        "name": "Confiscation"
      },
      "status": "forbidden"
    },
    {
      "card": {
        "passcode": 18144506,
        "name": "Harpie's Feather Duster"
      },
      "status": "forbidden"
    },
    {
      "card": {
        "passcode": 18318842,
        "name": "Abyss Soldier"
      },
      "status": "semilimited"
    },
    {
      "card": {
        "passcode": 19613556,
        "name": "Heavy Storm"
      },
      "status": "limited"
    },
    {
      "card": {
        "passcode": 21593977,
        "name": "Makyura the Destructor"
      },
      "status": "forbidden"
    },
    {
      "card": {
        "passcode": 24221739,
        "name": "Protector of the Sanctuary"
      },
      "status": "limited"
    },
    {
      "card": {
        "passcode": 26202165,
        "name": "Sangan"
      },
      "status": "limited"
    },
    {
      "card": {
        "passcode": 28566710,
        "name": "Last Turn"
      },
      "status": "semilimited"
    },
    {
      "card": {
        "passcode": 31036355,
        "name": "Creature Swap"
      },
      "status": "semilimited"
    },
    {
      "card": {
        "passcode": 32807846,
        "name": "Reinforcement of the Army"
      },
      "status": "semilimited"
    },
    {
      "card": {
        "passcode": 33184167,
        "name": "Tribe-Infecting Virus"
      },
      "status": "limited"
    },
    {
      "card": {
        "passcode": 33396948,
        "name": "Exodia the Forbidden One"
      },
      "status": "limited"
    },
    {
      "card": {
        "passcode": 33508719,
        "name": "Morphing Jar"
      },
      "status": "limited"
    },
    {
      "card": {
        "passcode": 34124316,
        "name": "Cyber Jar"
      },
      "status": "limited"
    },
    {
      "card": {
        "passcode": 34206604,
        "name": "Magical Scientist"
      },
      "status": "forbidden"
    },
    {
      "card": {
        "passcode": 35027493,
        "name": "Deck Devastation Virus"
      },
      "status": "limited"
    },
    {
      "card": {
        "passcode": 36468556,
        "name": "Ceasefire"
      },
      "status": "limited"
    },
    {
      "card": {
        "passcode": 37576645,
        "name": "Reckless Greed"
      },
      "status": "limited"
    },
    {
      "card": {
        "passcode": 40737112,
        "name": "Dark Magician of Chaos"
      },
      "status": "limited"
    },
    {
      "card": {
        "passcode": 41482598,
        "name": "Mirage of Nightmare"
      },
      "status": "forbidden"
    },
    {
      "card": {
        "passcode": 42829885,
        "name": "The Forceful Sentry"
      },
      "status": "forbidden"
    },
    {
      "card": {
        "passcode": 43586926,
        "name": "Twin-Headed Behemoth"
      },
      "status": "limited"
    },
    {
      "card": {
        "passcode": 44095762,
        "name": "Mirror Force"
      },
      "status": "limited"
    },
    {
      "card": {
        "passcode": 44519536,
        "name": "Left Leg of the Forbidden One"
      },
      "status": "limited"
    },
    {
      "card": {
        "passcode": 44763025,
        "name": "Delinquent Duo"
      },
      "status": "limited"
    },
    {
      "card": {
        "passcode": 45986603,
        "name": "Snatch Steal"
      },
      "status": "limited"
    },
    {
      "card": {
        "passcode": 53046408,
        "name": "Emergency Provisions"
      },
      "status": "semilimited"
    },
    {
      "card": {
        "passcode": 53129443,
        "name": "Dark Hole"
      },
      "status": "forbidden"
    },
    {
      "card": {
        "passcode": 53582587,
        "name": "Torrential Tribute"
      },
      "status": "limited"
    },
    {
      "card": {
        "passcode": 53839837,
        "name": "Vampire Lord"
      },
      "status": "semilimited"
    },
    {
      "card": {
        "passcode": 55144522,
        "name": "Pot of Greed"
      },
      "status": "limited"
    },
    {
      "card": {
        "passcode": 56747793,
        "name": "United We Stand"
      },
      "status": "limited"
    },
    {
      "card": {
        "passcode": 61441708,
        "name": "Sacred Phoenix of Nephthys"
      },
      "status": "limited"
    },
    {
      "card": {
        "passcode": 61587183,
        "name": "Dark Scorpion - Chick the Yellow"
      },
      "status": "semilimited"
    },
    {
      "card": {
        "passcode": 61740673,
        "name": "Imperial Order"
      },
      "status": "forbidden"
    },
    {
      "card": {
        "passcode": 62279055,
        "name": "Magic Cylinder"
      },
      "status": "limited"
    },
    {
      "card": {
        "passcode": 69162969,
        "name": "Lightning Vortex"
      },
      "status": "limited"
    },
    {
      "card": {
        "passcode": 69243953,
        "name": "Butterfly Dagger - Elma"
      },
      "status": "forbidden"
    },
    {
      "card": {
        "passcode": 70368879,
        "name": "Upstart Goblin"
      },
      "status": "semilimited"
    },
    {
      "card": {
        "passcode": 70828912,
        "name": "Premature Burial"
      },
      "status": "limited"
    },
    {
      "card": {
        "passcode": 70903634,
        "name": "Right Arm of the Forbidden One"
      },
      "status": "limited"
    },
    {
      "card": {
        "passcode": 71044499,
        "name": "Nobleman of Crossout"
      },
      "status": "semilimited"
    },
    {
      "card": {
        "passcode": 71413901,
        "name": "Breaker the Magical Warrior"
      },
      "status": "limited"
    },
    {
      "card": {
        "passcode": 72302403,
        "name": "Swords of Revealing Light"
      },
      "status": "limited"
    },
    {
      "card": {
        "passcode": 72892473,
        "name": "Card Destruction"
      },
      "status": "limited"
    },
    {
      "card": {
        "passcode": 72989439,
        "name": "Black Luster Soldier - Envoy of the Beginning"
      },
      "status": "limited"
    },
    {
      "card": {
        "passcode": 74131780,
        "name": "Exiled Force"
      },
      "status": "limited"
    },
    {
      "card": {
        "passcode": 74191942,
        "name": "Painful Choice"
      },
      "status": "forbidden"
    },
    {
      "card": {
        "passcode": 77121851,
        "name": "Manticore of Darkness"
      },
      "status": "semilimited"
    },
    {
      "card": {
        "passcode": 77585513,
        "name": "Jinzo"
      },
      "status": "limited"
    },
    {
      "card": {
        "passcode": 78010363,
        "name": "Witch of the Black Forest"
      },
      "status": "forbidden"
    },
    {
      "card": {
        "passcode": 78706415,
        "name": "Fiber Jar"
      },
      "status": "forbidden"
    },
    {
      "card": {
        "passcode": 79571449,
        "name": "Graceful Charity"
      },
      "status": "limited"
    },
    {
      "card": {
        "passcode": 79575620,
        "name": "Injection Fairy Lily"
      },
      "status": "limited"
    },
    {
      "card": {
        "passcode": 82301904,
        "name": "Chaos Emperor Dragon - Envoy of the End"
      },
      "status": "forbidden"
    },
    {
      "card": {
        "passcode": 83555666,
        "name": "Ring of Destruction"
      },
      "status": "limited"
    },
    {
      "card": {
        "passcode": 83746708,
        "name": "Mage Power"
      },
      "status": "limited"
    },
    {
      "card": {
        "passcode": 83764718,
        "name": "Monster Reborn"
      },
      "status": "forbidden"
    },
    {
      "card": {
        "passcode": 85742772,
        "name": "Gravity Bind"
      },
      "status": "semilimited"
    },
    {
      "card": {
        "passcode": 97077563,
        "name": "Call of the Haunted"
      },
      "status": "limited"
    }
  ],
  "completeness": "verified",
  "sources": [
    "yugipedia-april-2005",
    "ude-tournament-appendix-2005-08",